{
	"id": "fog",
	"icon": "mdi-weather-fog",
	"detect": {
		"packType": "resourcePack",
		"scope": "fogs/",
		"matcher": ["fogs/**/*", "fogs/*"],
		"fileContent": ["minecraft:fog"],
		"fileExtensions": [".json"]
	},

	"formatVersionMap": {
		"1.16.200": "1.16.100",
		"1.16.210": "1.16.100",
		"1.16.220": "1.16.100",
		"1.17.0": "1.16.100",
		"1.17.10": "1.16.100",
		"1.17.20": "1.16.100",
		"1.17.30": "1.16.100",
		"1.17.40": "1.16.100",
		"1.18.10": "1.16.100",
		"1.18.20": "1.16.100",
		"1.18.30": "1.16.100",
		"1.19.0": "1.16.100",
		"1.19.10": "1.16.100",
		"1.19.20": "1.16.100",
		"1.19.30": "1.16.100",
		"1.19.40": "1.16.100"
	},

	"schema": "file:///data/packages/minecraftBedrock/schema/fog/main.json",
	"lightningCache": "fog.json",

	"documentation": {
		"baseUrl": "https://bedrock.dev/docs/stable/Fogs",
		"supportsQuerying": false
	},
	"highlighterConfiguration": {
		"variables": ["description", "distance", "volumetric"],
		"typeIdentifiers": ["format_version"]
	}
}
