{
	"id": "customComponent",
	"type": "text",
	"icon": "mdi-language-javascript",
	"detect": {
		"packType": "behaviorPack",
		"scope": "components/entity/",
		"matcher": ["components/entity/**/*", "components/entity/*"],
		"fileExtensions": [".js", ".ts"]
	},

	"types": [
		"types/customComponent/common.d.ts",
		"types/customComponent/entity.d.ts"
	],

	"documentation": {
		"baseUrl": "https://bridge-core.app/extension-docs/custom-components",
		"supportsQuerying": false
	}
}
