{
	"id": "generatorScript",
	"type": "text",
	"icon": "mdi-cogs",
	"add": "post",
	"detect": {
		"packType": [
			"behaviorPack",
			"resourcePack",
			"skinPack",
			"worldTemplate"
		],
		"matcher": [
			"**/*",
			"!scripts/**/*",
			"!scripts/*",
			"!components/**/*",
			"!components/*",
			"!commands/**/*",
			"!commands/*",
			"!preprocessor_scripts/**/*",
			"!preprocessor_scripts/*"
		],
		"fileExtensions": [".js", ".ts"]
	},
	"types": ["types/generatorScript/main.d.ts"]
}
